{"$schema":"https://json-schema.org/draft/2020-12/schema","$id":"https://example.org/ls/profit-measurement-readiness.bundle.schema.json","title":"Profit Measurement Readiness Bundle V0","type":"object","additionalProperties":false,"required":["schemaVersion","bundleId","productRef","economicCandidateRef","decisionBinding","measurementPlan","implementation","evidence","readinessDecision","snapshot"],"properties":{"schemaVersion":{"const":"profit-measurement-readiness.bundle.v0"},"bundleId":{"type":"string","pattern":"^PMRB-[A-Z0-9-]+$"},"productRef":{"type":"string","pattern":"^PROD-[A-Z0-9-]+$"},"economicCandidateRef":{"type":"string","pattern":"^ECOHYP-[A-Z0-9-]+$"},"decisionBinding":{"type":"object","additionalProperties":false,"required":["decisionRef","candidateRef","candidateDigest","verdict"],"properties":{"decisionRef":{"type":"string","pattern":"^ECODEC-[A-Z0-9-]+$"},"candidateRef":{"type":"string","pattern":"^ECOHYP-[A-Z0-9-]+$"},"candidateDigest":{"type":"string","pattern":"^sha256:[a-f0-9]{64}$"},"verdict":{"const":"REQUEST_MORE_EVIDENCE"}}},"measurementPlan":{"$ref":"#/$defs/plan"},"implementation":{"oneOf":[{"type":"null"},{"$ref":"#/$defs/implementation"}]},"evidence":{"type":"array","uniqueItems":true,"items":{"$ref":"#/$defs/evidence"}},"readinessDecision":{"$ref":"#/$defs/readiness"},"snapshot":{"$ref":"#/$defs/snapshot"}},"$defs":{"actor":{"type":"string","pattern":"^[a-z0-9][a-z0-9._-]{2,80}$"},"plan":{"type":"object","additionalProperties":false,"required":["id","createdAt","createdBy","status","timezone","currency","attributionWindowHours","tokenContract","webContract","posContract","baselineContract","requiredEvidence","blockers"],"properties":{"id":{"type":"string","pattern":"^MPLAN-[A-Z0-9-]+$"},"createdAt":{"type":"string","format":"date-time"},"createdBy":{"$ref":"#/$defs/actor"},"status":{"enum":["INSTRUMENTATION_REQUIRED","READY_FOR_BASELINE","BASELINE_COLLECTING","BASELINE_COMPLETE"]},"timezone":{"type":"string","minLength":3},"currency":{"type":"string","pattern":"^[A-Z]{3}$"},"attributionWindowHours":{"type":"integer","minimum":1,"maximum":168},"tokenContract":{"type":"object","additionalProperties":false,"required":["namespace","tokenPattern","ttlHours","joinKey","collectsPII","prohibitedFields"],"properties":{"namespace":{"type":"string","pattern":"^[a-z][a-z0-9._-]{2,40}$"},"tokenPattern":{"type":"string","minLength":5},"ttlHours":{"type":"integer","minimum":1,"maximum":168},"joinKey":{"const":"campaign_token"},"collectsPII":{"const":false},"prohibitedFields":{"type":"array","minItems":3,"uniqueItems":true,"items":{"enum":["name","email","phone","device_fingerprint","precise_location"]}}}},"webContract":{"type":"object","additionalProperties":false,"required":["requiredEvents","tokenIssuedOn","deduplicationKey"],"properties":{"requiredEvents":{"type":"array","minItems":1,"uniqueItems":true,"items":{"type":"string","pattern":"^[a-z][a-z0-9_]{2,60}$"}},"tokenIssuedOn":{"type":"string","minLength":3},"deduplicationKey":{"const":"event_id"}}},"posContract":{"type":"object","additionalProperties":false,"required":["channel","requiredFields","deduplicationKey","joinKey"],"properties":{"channel":{"enum":["POS_EXPORT","RECEIPT_EXPORT"]},"requiredFields":{"type":"array","minItems":6,"uniqueItems":true,"items":{"type":"string","pattern":"^[a-z][a-z0-9_]{1,60}$"}},"deduplicationKey":{"const":"order_id"},"joinKey":{"const":"campaign_token"}}},"baselineContract":{"type":"object","additionalProperties":false,"required":["durationDays","primaryMetric","minimumSampleSize","comparisonRule"],"properties":{"durationDays":{"type":"integer","minimum":1,"maximum":90},"primaryMetric":{"const":"attributable_orders"},"minimumSampleSize":{"type":"integer","minimum":1},"comparisonRule":{"type":"string","minLength":10}}},"requiredEvidence":{"type":"array","minItems":4,"uniqueItems":true,"items":{"enum":["instrumentation_test","join_integrity","baseline_export","cost_source"]}},"blockers":{"type":"array","uniqueItems":true,"items":{"type":"string","minLength":10}}}},"implementation":{"type":"object","additionalProperties":false,"required":["id","repository","prNumber","headSha","files","status"],"properties":{"id":{"type":"string","pattern":"^MIMPL-[A-Z0-9-]+$"},"repository":{"type":"string","pattern":"^[^/\\s]+/[^/\\s]+$"},"prNumber":{"type":"integer","minimum":1},"headSha":{"type":"string","pattern":"^[a-f0-9]{40}$"},"files":{"type":"array","minItems":1,"uniqueItems":true,"items":{"type":"string","minLength":1}},"status":{"enum":["PROPOSED","IMPLEMENTED","VERIFIED"]}}},"evidence":{"type":"object","additionalProperties":false,"required":["id","kind","capturedAt","producer","locator","supports","confidence","implementationRef","headSha"],"properties":{"id":{"type":"string","pattern":"^MEVD-[A-Z0-9-]+$"},"kind":{"enum":["instrumentation_test","join_integrity","baseline_export","cost_source"]},"capturedAt":{"type":"string","format":"date-time"},"producer":{"$ref":"#/$defs/actor"},"locator":{"type":"string","minLength":1},"supports":{"type":"string","minLength":5},"confidence":{"type":"number","minimum":0,"maximum":1},"implementationRef":{"type":"string","pattern":"^MIMPL-[A-Z0-9-]+$"},"headSha":{"type":"string","pattern":"^[a-f0-9]{40}$"}}},"readiness":{"type":"object","additionalProperties":false,"required":["planRef","status","reason","evidenceRefs"],"properties":{"status":{"enum":["BLOCKED","READY_FOR_BASELINE","BASELINE_COMPLETE"]},"reason":{"type":"string","minLength":10},"evidenceRefs":{"type":"array","uniqueItems":true,"items":{"type":"string","pattern":"^MEVD-[A-Z0-9-]+$"}},"planRef":{"type":"string","pattern":"^MPLAN-[A-Z0-9-]+$"},"implementationRef":{"type":"string","pattern":"^MIMPL-[A-Z0-9-]+$"}}},"snapshot":{"type":"object","additionalProperties":false,"required":["snapshotId","generatedAt","activePlanRefs","blockedPlanRefs","sourcePlanRefs"],"properties":{"snapshotId":{"type":"string","pattern":"^MSNAP-[A-Z0-9-]+$"},"generatedAt":{"type":"string","format":"date-time"},"activePlanRefs":{"type":"array","uniqueItems":true,"items":{"type":"string","pattern":"^MPLAN-[A-Z0-9-]+$"}},"blockedPlanRefs":{"type":"array","uniqueItems":true,"items":{"type":"string","pattern":"^MPLAN-[A-Z0-9-]+$"}},"sourcePlanRefs":{"type":"array","uniqueItems":true,"items":{"type":"string","pattern":"^MPLAN-[A-Z0-9-]+$"}}}}}}
