{"schemaVersion":"profit-measurement-readiness.bundle.v0","bundleId":"PMRB-ROBYS-MENU-TO-VISIT-001","productRef":"PROD-ROBYS-WEB","economicCandidateRef":"ECOHYP-ROBYS-MENU-TO-VISIT-001","decisionBinding":{"decisionRef":"ECODEC-ROBYS-MENU-TO-VISIT-001","candidateRef":"ECOHYP-ROBYS-MENU-TO-VISIT-001","candidateDigest":"sha256:a2c18c5908a5db703ddeebb3ea398a88e8832e48c0567169f5a5c64315b9c8e5","verdict":"REQUEST_MORE_EVIDENCE"},"measurementPlan":{"id":"MPLAN-ROBYS-MENU-TO-VISIT-001","createdAt":"2026-07-04T08:30:00+03:00","createdBy":"product-strategy","status":"INSTRUMENTATION_REQUIRED","timezone":"Europe/Istanbul","currency":"TRY","attributionWindowHours":24,"tokenContract":{"namespace":"robys.visit","tokenPattern":"rv_[a-z0-9]{20}","ttlHours":24,"joinKey":"campaign_token","collectsPII":false,"prohibitedFields":["name","email","phone","device_fingerprint","precise_location"]},"webContract":{"requiredEvents":["visit_intent_created"],"tokenIssuedOn":"map or offer CTA activation","deduplicationKey":"event_id"},"posContract":{"channel":"POS_EXPORT","requiredFields":["order_id","ordered_at","campaign_token","gross_revenue","currency","variable_cost"],"deduplicationKey":"order_id","joinKey":"campaign_token"},"baselineContract":{"durationDays":7,"primaryMetric":"attributable_orders","minimumSampleSize":20,"comparisonRule":"Compare attributable orders and net contribution against the immediately preceding seven-day baseline."},"requiredEvidence":["instrumentation_test","join_integrity","baseline_export","cost_source"],"blockers":["No verified Roby's repository head is attached.","No durable campaign-token persistence is implemented.","No POS export containing the required join and economics fields is available.","No baseline or cost-source evidence has been captured."]},"implementation":null,"evidence":[],"readinessDecision":{"planRef":"MPLAN-ROBYS-MENU-TO-VISIT-001","status":"BLOCKED","reason":"Measurement cannot begin until token instrumentation and POS attribution are implemented and independently verified.","evidenceRefs":[]},"snapshot":{"snapshotId":"MSNAP-ROBYS-MENU-TO-VISIT-001","generatedAt":"2026-07-04T08:35:00+03:00","activePlanRefs":[],"blockedPlanRefs":["MPLAN-ROBYS-MENU-TO-VISIT-001"],"sourcePlanRefs":["MPLAN-ROBYS-MENU-TO-VISIT-001"]}}
